{"created":"2022-03-09T07:54:39.115623+00:00","id":2003301,"links":{"self":"https://repository.dl.itc.u-tokyo.ac.jp/api/records/2003301"},"metadata":{"_buckets":{"deposit":"0f877fa2-b1eb-4936-8967-9d8cd8ca92cd"},"_deposit":{"id":"2003301","owner":1,"owners":[1],"pid":{"revision_id":0,"type":"depid","value":"2003301"},"status":"published","weko_shared_ids":[]},"_oai":{"id":"oai:repository.dl.itc.u-tokyo.ac.jp:02003301","sets":["292","280"]},"author_link":[],"item_1623978586063":{"attribute_name":"出版タイプ","attribute_value_mlt":[{"subitem_version_type":"VoR"}]},"item_7_biblio_info_7":{"attribute_name":"書誌情報","attribute_value_mlt":[{"bibliographicIssueDates":{"bibliographicIssueDate":"2019-03-07","bibliographicIssueDateType":"Issued"}}]},"item_7_date_granted_25":{"attribute_name":"学位授与年月日","attribute_value_mlt":[{"subitem_dategranted":"2019-03-07"}]},"item_7_degree_grantor_23":{"attribute_name":"学位授与機関","attribute_value_mlt":[{"subitem_degreegrantor":[{"subitem_degreegrantor_language":"ja","subitem_degreegrantor_name":"東京大学"},{"subitem_degreegrantor_language":"en","subitem_degreegrantor_name":"The University of Tokyo"}],"subitem_degreegrantor_identifier":[{"subitem_degreegrantor_identifier_name":"12601","subitem_degreegrantor_identifier_scheme":"kakenhi"}]}]},"item_7_degree_name_20":{"attribute_name":"学位名","attribute_value_mlt":[{"subitem_degreename":"博士(工学)","subitem_degreename_language":"ja"}]},"item_7_description_6":{"attribute_name":"内容記述","attribute_value_mlt":[{"subitem_description":"学位の種別: 論文博士","subitem_description_language":"ja","subitem_description_type":"Other"},{"subitem_description":"審査委員会委員 : （主査）東京大学教授 岸 利治, 東京大学教授 野口 貴文, 東京大学教授 石田 哲也, 東京大学講師 酒井 雄也, 東京大学講師 高橋 佑弥","subitem_description_language":"ja","subitem_description_type":"Other"}]},"item_7_dissertation_number_26":{"attribute_name":"学位授与番号","attribute_value_mlt":[{"subitem_dissertationnumber":"乙第18487号"}]},"item_7_identifier_registration":{"attribute_name":"ID登録","attribute_value_mlt":[{"subitem_identifier_reg_text":"10.15083/0002003301","subitem_identifier_reg_type":"JaLC"}]},"item_7_text_24":{"attribute_name":"研究科・専攻","attribute_value_mlt":[{"subitem_text_value":"Graduate School of Engineering (工学系研究科)"}]},"item_7_text_27":{"attribute_name":"学位記番号","attribute_value_mlt":[{"subitem_text_language":"ja","subitem_text_value":"乙第18487号"}]},"item_access_right":{"attribute_name":"アクセス権","attribute_value_mlt":[{"subitem_access_right":"open access","subitem_access_right_uri":"http://purl.org/coar/access_right/c_abf2"}]},"item_creator":{"attribute_name":"著者","attribute_type":"creator","attribute_value_mlt":[{"creatorNames":[{"creatorName":"齋藤, 尚","creatorNameLang":"ja"},{"creatorName":"Saito, Hisashi","creatorNameLang":"en"}]}]},"item_files":{"attribute_name":"ファイル情報","attribute_type":"file","attribute_value_mlt":[{"accessrole":"open_date","date":[{"dateType":"Available","dateValue":"2022-03-09"}],"displaytype":"detail","filename":"B18487.pdf","filesize":[{"value":"5.9MB"}],"format":"application/pdf","licensetype":"license_free","mimetype":"application/pdf","url":{"objectType":"fulltext","url":"https://repository.dl.itc.u-tokyo.ac.jp/record/2003301/files/B18487.pdf"},"version_id":"3af8aafd-2cb4-41c9-a096-f2051a340087"},{"accessrole":"open_date","date":[{"dateType":"Available","dateValue":"2022-03-09"}],"displaytype":"detail","filename":"B18487_abstract.pdf","filesize":[{"value":"114.7KB"}],"format":"application/pdf","licensetype":"license_free","mimetype":"application/pdf","url":{"objectType":"abstract","url":"https://repository.dl.itc.u-tokyo.ac.jp/record/2003301/files/B18487_abstract.pdf"},"version_id":"5211d27a-1e40-4e3a-8a6e-44cd27caed40"},{"accessrole":"open_date","date":[{"dateType":"Available","dateValue":"2022-03-09"}],"displaytype":"detail","filename":"B18487_review.pdf","filesize":[{"value":"154.3KB"}],"format":"application/pdf","licensetype":"license_free","mimetype":"application/pdf","url":{"objectType":"other","url":"https://repository.dl.itc.u-tokyo.ac.jp/record/2003301/files/B18487_review.pdf"},"version_id":"a5e10f84-5ceb-48a7-908e-2b77620abe70"}]},"item_language":{"attribute_name":"言語","attribute_value_mlt":[{"subitem_language":"jpn"}]},"item_resource_type":{"attribute_name":"資源タイプ","attribute_value_mlt":[{"resourcetype":"doctoral thesis","resourceuri":"http://purl.org/coar/resource_type/c_db06"}]},"item_title":"徐放材料でコーティングした自己治癒材料の開発および自己治癒効果の評価方法の提案","item_titles":{"attribute_name":"タイトル","attribute_value_mlt":[{"subitem_title":"徐放材料でコーティングした自己治癒材料の開発および自己治癒効果の評価方法の提案","subitem_title_language":"ja"}]},"item_type_id":"7","owner":1,"owners":[1],"path":["292","280"],"pubdate":{"attribute_name":"PubDate","attribute_value":"2022-03-09"},"publish_date":"2022-03-09","publish_status":"0","recid":"2003301","relation_version_is_last":true,"title":["徐放材料でコーティングした自己治癒材料の開発および自己治癒効果の評価方法の提案"],"weko_shared_ids":[]},"updated":"2026-03-18T07:44:36.704721+00:00"}